<?xml version="1.0" encoding="UTF-8"?>
<!--

    Copyright 2017 Goldman Sachs.
    Licensed under the Apache License, Version 2.0 (the "License");
    you may not use this file except in compliance with the License.
    You may obtain a copy of the License at

    http://www.apache.org/licenses/LICENSE-2.0

    Unless required by applicable law or agreed to in writing,
    software distributed under the License is distributed on an
    "AS IS" BASIS, WITHOUT WARRANTIES OR CONDITIONS OF ANY
    KIND, either express or implied.  See the License for the
    specific language governing permissions and limitations
    under the License.

-->
<CatoResources xmlns="http://www.cato.com/CatoResources"
    xmlns:xsi="http://www.w3.org/2001/XMLSchema-instance"
    xsi:schemaLocation="http://www.cato.com/CatoResources CatoResources.xsd ">
    <Recons>
        <Recon id="recon0" name="recon0">
            <DataSource1>ds0</DataSource1>
            <DataSource2>ds1</DataSource2>
        </Recon>
        <Recon id="recon1" name="recon1">
            <DataSource1>ds0</DataSource1>
            <DataSource2>ds1</DataSource2>
        </Recon>
        <Recon id="TextRecon1" name="TextRecon1">
            <DataSource1>TextDataSource1</DataSource1>
            <DataSource2>TextDataSource2</DataSource2>
            <Field isKey="true">
                <Name>Key 1</Name>
            </Field>
            <Field isKey="true">
                <Name>Key 2</Name>
            </Field>
            <Field isAttribute="true">
                <Name>Val 1</Name>
            </Field>
            <Field isAttribute="true">
                <Name>Val 2</Name>
            </Field>
            <Field isAttribute="true">
                <Name>Val 3</Name>
            </Field>
            <Field isAttribute="true" isExcluded="true">
                <Name>Val 4</Name>
            </Field>
        </Recon>
    </Recons>
    <DataSources>
        <DBDataSource id="ds0" name="ds0" sorted="false">
            <url>testurl1</url>
            <user>testuser1</user>
            <password>testpassword1</password>
            <query>testquery1</query>
        </DBDataSource>
        <DBDataSource id="ds1" name="ds1" sorted="false">
            <url>testurl2</url>
            <user>testuser2</user>
            <password>testpassword2</password>
            <query>testquery2</query>
        </DBDataSource>
        <TextDataSource id="TextDataSource1" name="TextDataSource1" sorted="false">
            <File>H:/open-source/cato-parent/cato-core/src/test/resources/testdata1.txt</File>
            <Delimiter>,</Delimiter>
        </TextDataSource>
        <TextDataSource id="TextDataSource2" name="TextDataSource2" sorted="false">
            <File>H:/open-source/cato-parent/cato-core/src/test/resources/testdata2.txt</File>
            <Delimiter>,</Delimiter>
        </TextDataSource>
    </DataSources>
</CatoResources>
